<?xml version="1.0" encoding="UTF-8" ?>
<xs:schema xmlns:xs="http://www.w3.org/2001/XMLSchema"
           targetNamespace="http://univ.fr/cv24" xmlns="http://univ.fr/cv24"
           elementFormDefault="unqualified">

    <!-- Element -->
    <xs:element name="cv24" type="cv24"></xs:element>
    <xs:element name="identite" type="identiteType" ></xs:element>
    <xs:element name="objectif" type="objectifType"></xs:element>
    <xs:element name="prof" type="profType"></xs:element>
    <xs:element name="competences" type="competencesType"></xs:element>
    <xs:element name="divers" type="diversType"></xs:element>

    <xs:complexType name="cv24">
        <xs:all>
            <xs:element ref="identite" minOccurs="1" maxOccurs="1"></xs:element>
            <xs:element ref="objectif" minOccurs="1" maxOccurs="1"></xs:element>
            <xs:element ref="prof" minOccurs="0" maxOccurs="1"></xs:element>
            <xs:element ref="competences"  minOccurs="1" maxOccurs="1"></xs:element>
            <xs:element ref="divers" minOccurs="0" maxOccurs="1"></xs:element>
        </xs:all>
    </xs:complexType>

    <!-- Represente la section identité du CV -->
    <xs:complexType name="identiteType">
        <xs:sequence>
            <xs:element name="genre" type="genreType" minOccurs="1" maxOccurs="1"></xs:element>
            <xs:element name="nom" type="texteMaj32" minOccurs="1" maxOccurs="1"></xs:element>
            <xs:element name="prenom" type="texte32" minOccurs="1" maxOccurs="1"></xs:element>
            <xs:element name="tel" type="telType" minOccurs="0" maxOccurs="1"></xs:element>
            <xs:element name="mail" type="Fmail" minOccurs="0" maxOccurs="1"></xs:element>
        </xs:sequence>
    </xs:complexType>

    <!-- Represente les différents genre possbile -->
    <xs:simpleType name="genreType">
        <xs:restriction base="xs:string">
            <xs:enumeration value="Mme"></xs:enumeration>
            <xs:enumeration value="M."></xs:enumeration>
            <xs:enumeration value="Miss"></xs:enumeration>
            <xs:enumeration value="Mrs"></xs:enumeration>
            <xs:enumeration value="Mr"></xs:enumeration>
        </xs:restriction>
    </xs:simpleType>

    <!-- Represente le format des emails -->
    <xs:simpleType name="Fmail">
        <xs:restriction base="xs:string">
            <xs:maxLength value="128"></xs:maxLength>
            <xs:pattern value="[\p{L}\p{Nd}_-]+([\p{L}\p{Nd}_-]|\.([\p{L}\p{Nd}_-]))+@[^\.]([\p{L}\p{Nd}_-]|\.([\p{L}\p{Nd}_-]))+(\.[a-zA-Z]{2,3})"/>
        </xs:restriction>
    </xs:simpleType>

    <!-- Represente le format des numéros de téléphone -->
    <xs:simpleType name="telType">
        <xs:restriction base="xs:string">
            <xs:pattern value="(\d{10})|(\d{2}\s\d{2}\s\d{2}\s\d{2}\s\d{2})|(\d\s\d{3}\s\d{3}\s\d{3})|(\+33\s\d\s\d{2}\s\d{2}\s\d{2}\s\d{2})"/>
        </xs:restriction>
    </xs:simpleType>
    <!-- Represente la section obectif du CV -->
    <xs:complexType name="objectifType">
        <xs:sequence>
            <xs:element name="objectif" type="texte128" minOccurs="1" maxOccurs="1"></xs:element>
        </xs:sequence>
        <xs:attribute name="status" use="required">
            <xs:simpleType >
                <xs:restriction base="xs:string">
                    <xs:enumeration value="emploi"></xs:enumeration>
                    <xs:enumeration value="stage"></xs:enumeration>
                </xs:restriction>
            </xs:simpleType>
        </xs:attribute>
    </xs:complexType>

    <!-- Represente la section prof du CV -->
    <xs:complexType name="profType">
        <xs:sequence>
            <xs:element name="detail" type="detailType" minOccurs="1" maxOccurs="unbounded"></xs:element>
        </xs:sequence>
    </xs:complexType>

    <xs:complexType name="detailType">
        <xs:sequence>
            <xs:element name="datedeb" type="xs:date" minOccurs="1" maxOccurs="1"></xs:element>
            <xs:element name="datefin" type="xs:date" minOccurs="0" maxOccurs="1"></xs:element>
            <xs:element name="titre" type="texte128" minOccurs="1" maxOccurs="1"></xs:element>
        </xs:sequence>
    </xs:complexType>

    <!-- Represente la section compétences du CV -->
    <xs:complexType name="competencesType">
        <xs:sequence>
            <xs:element name="diplôme" type="detaildiplome" minOccurs="1" maxOccurs="5"></xs:element>
            <xs:element name="certif" type="certifType" minOccurs="0" maxOccurs="unbounded"></xs:element>
        </xs:sequence>
    </xs:complexType>

    <xs:complexType name="detaildiplome">
        <xs:sequence>
            <xs:element name="date" type="xs:date" minOccurs="1" maxOccurs="1"></xs:element>
            <xs:element name="institut" type="texte32" minOccurs="0" maxOccurs="1"></xs:element>
            <xs:element name="titre" type="texte32" minOccurs="1" maxOccurs="5"></xs:element>
        </xs:sequence>
        <xs:attribute name="niveau" type="niveauType" use="required"></xs:attribute>
    </xs:complexType>

    <!-- Force les valeurs de niveau entre 1 et 8 -->
    <xs:simpleType name="niveauType">
        <xs:restriction base="xs:int">
            <xs:maxInclusive value="8"></xs:maxInclusive>
            <xs:minInclusive value="1"></xs:minInclusive>
        </xs:restriction>
    </xs:simpleType>

    <xs:complexType name="certifType">
        <xs:sequence>
            <xs:element name="datedeb" type="xs:date" minOccurs="1" maxOccurs="1"></xs:element>
            <xs:element name="datefin" type="xs:date" minOccurs="0" maxOccurs="1"></xs:element>
            <xs:element name="titre" type="texte32" minOccurs="1" maxOccurs="1"></xs:element>
        </xs:sequence>
    </xs:complexType>

    <!-- Represente la section divers du CV -->
    <xs:complexType name="diversType">
        <xs:sequence>
            <xs:element name="lv" type="lvType" minOccurs="1" maxOccurs="5"></xs:element>
            <xs:element name="autre" type="autreType" minOccurs="0" maxOccurs="3"></xs:element>
        </xs:sequence>
    </xs:complexType>

    <xs:complexType name="autreType">
        <xs:attribute name="titre" type="texte32" use="required"></xs:attribute>
        <xs:attribute name="comment" type="texte128" use="optional"></xs:attribute>
    </xs:complexType>


    <xs:complexType name="lvType">
        <xs:attribute name="lang" type="xs:string" use="required"></xs:attribute>
        <xs:attribute name="cert" type="certifiType" use="required"></xs:attribute>
        <xs:attribute name="nivs" type="nivType" use="optional"></xs:attribute>
        <xs:attribute name="nivi" type="niviType" use="optional"></xs:attribute>
    </xs:complexType>

    <xs:simpleType name="formatlang">
        <xs:restriction base="xs:string">
            <xs:maxLength value="2"></xs:maxLength>
            <xs:pattern value="[a-z]{2}"/>
        </xs:restriction>
    </xs:simpleType>

    <xs:simpleType name="certifiType">
        <xs:restriction base="xs:string">
            <xs:enumeration value="MAT"></xs:enumeration>
            <xs:enumeration value="CLES"></xs:enumeration>
            <xs:enumeration value="TOEIC"></xs:enumeration>
        </xs:restriction>
    </xs:simpleType>

    <xs:simpleType name="nivType">
        <xs:restriction base="xs:string">
            <xs:enumeration value="A1"></xs:enumeration>
            <xs:enumeration value="A2"></xs:enumeration>
            <xs:enumeration value="B1"></xs:enumeration>
            <xs:enumeration value="B2"></xs:enumeration>
            <xs:enumeration value="C1"></xs:enumeration>
        </xs:restriction>
    </xs:simpleType>

    <xs:simpleType name="niviType">
        <xs:restriction base="xs:int">
            <xs:maxInclusive value="990"></xs:maxInclusive>
            <xs:minInclusive value="10"></xs:minInclusive>
        </xs:restriction>
    </xs:simpleType>

    <!-- SECTION FORMAT TEXTE -->
    <!-- Represente les textes au format String32Maj -->
    <xs:simpleType name="texteMaj32">
        <xs:restriction base="xs:string">
            <xs:maxLength value="32"></xs:maxLength>
            <xs:pattern value="[\p{Lu}\s'\-]{1,32}"/>
        </xs:restriction>
    </xs:simpleType>

    <!-- Represente les textes au format String32 -->
    <xs:simpleType name="texte32">
        <xs:restriction base="xs:string">
            <xs:maxLength value="32"></xs:maxLength>
            <xs:pattern value="[\p{L}\s'\-]{1,32}"/>
        </xs:restriction>
    </xs:simpleType>

    <!-- Represente les textes au format String128 -->
    <xs:simpleType name="texte128">
        <xs:restriction base="xs:string">
            <xs:maxLength value="128"></xs:maxLength>
            <xs:pattern value="[\p{L}\p{Nd}\s.,:;'@()-=_*~$?!#&amp;]{1,128}"></xs:pattern>
        </xs:restriction>
    </xs:simpleType>
</xs:schema>