<?xml version="1.0" encoding="UTF-8"?>
<cv24:cv24 xmlns:cv24="http://univ.fr/cv24" xmlns:xsi="http://www.w3.org/2001/XMLSchema-instance" xsi:schemaLocation="http://univ.fr/cv24 cv24.xsd ">
    <cv24:identite>
        <genre>Mr</genre>
        <nom>OLIVIER</nom>
        <prenom>THOMAS</prenom>
        <tel>+33 1 23 45 67 89</tel>
        <mail>thomas@gmail.com</mail>
    </cv24:identite>
    <cv24:objectif status="stage">
        <objectif>AAAadjajoiqjfia1141412389.,':;@~$#()&amp;?!$*-_=</objectif>
    </cv24:objectif>
    <cv24:prof>
        <detail>
            <datedeb>2024-04-11</datedeb>
            <datefin>2024-04-11</datefin>
            <titre>mangeur de hot-dog</titre>
        </detail>
    </cv24:prof>
    <cv24:competences>
        <diplôme niveau="5">
            <date>2024-04-11</date>
            <institut>fhuadfh	faoiuzepeggzgezgeezgzhçf</institut>
            <titre>bac</titre>
            <titre>licence</titre>
            <titre>master</titre>
            <titre>doctorat</titre>
            <titre>iron man</titre>

        </diplôme>
        <certif>
            <datedeb>2024-04-11</datedeb>
            <datefin>2024-04-11</datefin>
            <titre>afu</titre>
        </certif>
        <certif>
            <datedeb>2024-04-11</datedeb>
            <titre>afu</titre>
        </certif>
        <certif>
            <datedeb>2024-04-11</datedeb>
            <titre>fhuadfh	faoiuzepeggzgezgeezgzhçf</titre>
        </certif>
        <certif>
            <datedeb>2024-04-11</datedeb>
            <datefin>2024-04-11</datefin>
            <titre>afu</titre>
        </certif>
    </cv24:competences>
    <cv24:divers>
        <lv lang="fr" cert="CLES" nivs="B1"/>
        <autre titre="sportif de haut niveau" comment="natation"></autre>
    </cv24:divers>
</cv24:cv24>